{
  "schema": "ai-peer-review.process-source-registration/v1",
  "captureId": "source-32a383ae93be438850d29b005c867191",
  "hostId": "sha256:88b178f6b6285e51401eb90bca58e3d7e033632aca2544f477947268672dec1e",
  "publicKey": "MCowBQYDK2VwAyEAeJKSS7HJzYRWre6Laz0bhd0rjQ9Ryaq6GFmCcYSb8xY=",
  "keyId": "sha256:4f5880dcf2443c643b5a206adfb1ee547cb274b21d1e918ed1938a5e70f44b7a",
  "package": {
    "schema": "ai-peer-review.process-source-package/v1",
    "sourceCommit": "07835545b0cd518a9e48667ed6fc4b9d13bdb6bc",
    "tarballDigest": "sha256:21331c1d1a9804d3d5cd4d7371d56866aeca54ed2d675a0a4c4f5dc325fdcf2f",
    "inventoryDigest": "sha256:dae2c97624b6a455b88923b2321d15c6d3232ff80201bbf35503e6f5996a51a5",
    "contractDigest": "sha256:340ece55ae98dcd5a8fb9cdd85b16138b0d0db3bcf44e55c13dc25b357dedb25"
  },
  "scope": {
    "platform": "linux",
    "build": "6.17.0-1022-azure",
    "architecture": "x64",
    "nodeMajor": 26,
    "probe": {
      "path": "/proc",
      "visibility": "full-pid-namespace",
      "errorContract": "exact-pid-directory-v1",
      "version": "procfs-v1"
    }
  },
  "kinds": ["creation"],
  "transitions": ["clock-forward", "clock-backward", "timezone", "dst"]
}
