{
  "schema": "ai-peer-review.process-source-registration/v1",
  "captureId": "source-fc9482e6672e57c90d34396b063a115c",
  "hostId": "sha256:769cf77b93e9a04e25f5397968b208f4c6f29ba9673e36119ce77c86d0c43f2d",
  "publicKey": "MCowBQYDK2VwAyEAYXMtMMepHM7v4gPQ8XclsWa/7U+SdkUNplAsmpQTGFs=",
  "keyId": "sha256:0299d4ddc1452e2b90a0308b291be76e1d54a815eb4361bedd85d17e46a69c49",
  "package": {
    "schema": "ai-peer-review.process-source-package/v1",
    "sourceCommit": "2a6adf5b057084ada54ca0708e0a0f02482ce85a",
    "tarballDigest": "sha256:5fed440bf7e734c9e311d854c464db1270f9434bb72b87db4ceedfaea31b27da",
    "inventoryDigest": "sha256:4cf3ce9016236a00eda5cd31c86d1ac98b87768ec35e3e7c51f7961205d4a0f2",
    "contractDigest": "sha256:340ece55ae98dcd5a8fb9cdd85b16138b0d0db3bcf44e55c13dc25b357dedb25"
  },
  "scope": {
    "platform": "linux",
    "build": "6.17.0-1022-azure",
    "architecture": "x64",
    "nodeMajor": 24,
    "probe": {
      "path": "/proc",
      "visibility": "full-pid-namespace",
      "errorContract": "exact-pid-directory-v1",
      "version": "procfs-v1"
    }
  },
  "kinds": ["absence"],
  "transitions": []
}
