{
  "schema": "ai-peer-review.process-source-registration/v1",
  "captureId": "source-73fd05fabb50d27935a6b547a235df7e",
  "hostId": "sha256:33d6db92d12313408eb2bfb4d5ea74c7dd5d9508e70eb7d6ce8cddfac0358632",
  "publicKey": "MCowBQYDK2VwAyEAbog+WXAsgE08ica985xvzL3zMd5+bm8NF+PeZSh7Up8=",
  "keyId": "sha256:936f11233d0b2499a7a431864e2645639a75675000d70fe0b6f988220709f44b",
  "package": {
    "schema": "ai-peer-review.process-source-package/v1",
    "sourceCommit": "9fe68172d19ce9f217fed42cf466ba5667368464",
    "tarballDigest": "sha256:21331c1d1a9804d3d5cd4d7371d56866aeca54ed2d675a0a4c4f5dc325fdcf2f",
    "inventoryDigest": "sha256:dae2c97624b6a455b88923b2321d15c6d3232ff80201bbf35503e6f5996a51a5",
    "contractDigest": "sha256:340ece55ae98dcd5a8fb9cdd85b16138b0d0db3bcf44e55c13dc25b357dedb25"
  },
  "scope": {
    "platform": "linux",
    "build": "6.17.0-1022-azure",
    "architecture": "x64",
    "nodeMajor": 24,
    "probe": {
      "path": "/proc",
      "visibility": "full-pid-namespace",
      "errorContract": "exact-pid-directory-v1",
      "version": "procfs-v1"
    }
  },
  "kinds": ["absence"],
  "transitions": []
}
