{
  "schema": "ai-peer-review.process-source-registration/v1",
  "captureId": "source-6cabf7eeb2a39db4ed492630308a14b8",
  "hostId": "sha256:d91bbe7afafbedcb746995cafda71091665a730e7934bbca864d4fa5ec196e39",
  "publicKey": "MCowBQYDK2VwAyEA4HsvTaSuAoLPhH74JN5izs0Sid/9EvC8HyfpYDbtVgs=",
  "keyId": "sha256:a4334e39ed2cbe85464930dcc09bcb1931d9a8881b2e32cc6a61c30ef2ef3991",
  "package": {
    "schema": "ai-peer-review.process-source-package/v1",
    "sourceCommit": "11c83fa0c1b01448719bbbb336d41296fd17ec91",
    "tarballDigest": "sha256:7a5417fbd5a0ed142e2550d349f34e370a8b982caf50279bd1aaef95d1c5908a",
    "inventoryDigest": "sha256:e3c4c6c16b3b74e0a955a913f840f10dbb228be515d1bde2b4ee7a5cd2fb62c3",
    "contractDigest": "sha256:505bc7fed2cd1b35874ab5bcb30a891f5d96a699fc08fedd932060b3d4601b0e"
  },
  "scope": {
    "platform": "linux",
    "build": "6.17.0-1022-azure",
    "architecture": "x64",
    "nodeMajor": 24,
    "probe": {
      "path": "/proc",
      "visibility": "full-pid-namespace",
      "errorContract": "exact-pid-directory-v1",
      "version": "procfs-v1"
    }
  },
  "kinds": ["creation"],
  "transitions": ["clock-forward", "clock-backward", "timezone", "dst"]
}
