{
  "schema": "ai-peer-review.process-source-registration/v1",
  "captureId": "source-2311c91f64a1977da398fcb461a32cb2",
  "hostId": "sha256:3dee427a3ef8f54e7eeedb0e123cd89764179f56c464224942973b7c8aee4692",
  "publicKey": "MCowBQYDK2VwAyEAdwa7uDryFr2EctN/Vw6ImjM6gfItsdjHJ0kJOYFmCpg=",
  "keyId": "sha256:6928da5acd4cc64d00e108be7fd66d3f2dd434a9f7190b1016d4d018fc22fd08",
  "package": {
    "schema": "ai-peer-review.process-source-package/v1",
    "sourceCommit": "9fe68172d19ce9f217fed42cf466ba5667368464",
    "tarballDigest": "sha256:21331c1d1a9804d3d5cd4d7371d56866aeca54ed2d675a0a4c4f5dc325fdcf2f",
    "inventoryDigest": "sha256:dae2c97624b6a455b88923b2321d15c6d3232ff80201bbf35503e6f5996a51a5",
    "contractDigest": "sha256:340ece55ae98dcd5a8fb9cdd85b16138b0d0db3bcf44e55c13dc25b357dedb25"
  },
  "scope": {
    "platform": "linux",
    "build": "6.17.0-1022-azure",
    "architecture": "x64",
    "nodeMajor": 26,
    "probe": {
      "path": "/proc",
      "visibility": "full-pid-namespace",
      "errorContract": "exact-pid-directory-v1",
      "version": "procfs-v1"
    }
  },
  "kinds": ["absence"],
  "transitions": []
}
