{
  "schema": "ai-peer-review.process-source-registration/v1",
  "captureId": "source-74d6e472e2ecc1a780a01716d7a51b13",
  "hostId": "sha256:e72672bfda8bb04403855476c4dcc188ebcbc561a2776eba93bc9a960d2825c2",
  "publicKey": "MCowBQYDK2VwAyEAhaUixY4nMFznhGI+oLh/Q6ufapAluYd5HAIlgQWakeo=",
  "keyId": "sha256:f75975def23bd5584464306fffbbc08697ddce4a76b058f9e0b32f060ec8c2cc",
  "package": {
    "schema": "ai-peer-review.process-source-package/v1",
    "sourceCommit": "edc0585afd21be8e645b4903323b116225987711",
    "tarballDigest": "sha256:8d42ec62541ba454b0ddf07e93b6c227743f2b77dc2849fa78c1bb4e74e9ebe3",
    "inventoryDigest": "sha256:671b62eb6fcf2c0393d46d1808e3a57a01085c8512ec0a0460e04e3f227e5ac6",
    "contractDigest": "sha256:e9793b094e58189caa9db25db3da6da6139ba3bddb7466fadf66df173732c66e"
  },
  "scope": {
    "platform": "linux",
    "build": "6.17.0-1022-azure",
    "architecture": "x64",
    "nodeMajor": 24,
    "probe": {
      "path": "/proc",
      "visibility": "full-pid-namespace",
      "errorContract": "exact-pid-directory-v1",
      "version": "procfs-v1"
    }
  },
  "kinds": ["absence"],
  "transitions": []
}
