{
  "schema": "ai-peer-review.process-source-registration/v1",
  "captureId": "source-374f07b77545a8e320130f34b2c03b43",
  "hostId": "sha256:82731eb46e64a2a2f5446162e11a6bd270cde2d65e08ed9448829e04d24598f8",
  "publicKey": "MCowBQYDK2VwAyEArFbI7Z32T8LQoHZ4/23EmZniAWaW50E0tN9BDkLFi9s=",
  "keyId": "sha256:a8a4804851252268892786819da5d3941950f627d9db00faf6f519bc2a54d7e5",
  "package": {
    "schema": "ai-peer-review.process-source-package/v1",
    "sourceCommit": "11c83fa0c1b01448719bbbb336d41296fd17ec91",
    "tarballDigest": "sha256:7a5417fbd5a0ed142e2550d349f34e370a8b982caf50279bd1aaef95d1c5908a",
    "inventoryDigest": "sha256:e3c4c6c16b3b74e0a955a913f840f10dbb228be515d1bde2b4ee7a5cd2fb62c3",
    "contractDigest": "sha256:505bc7fed2cd1b35874ab5bcb30a891f5d96a699fc08fedd932060b3d4601b0e"
  },
  "scope": {
    "platform": "darwin",
    "build": "25.6.0",
    "architecture": "arm64",
    "nodeMajor": 26,
    "probe": {
      "path": "/bin/ps",
      "visibility": "same-user-full-selection",
      "errorContract": "exact-ps-selection-v1",
      "version": "sha256:62c342e1351240eb62402b3fc8f7affed8d2d0bc8fa498df358dec09108b940f"
    }
  },
  "kinds": ["absence"],
  "transitions": []
}
