{
  "schema": "ai-peer-review.process-source-registration/v1",
  "captureId": "source-dd5736e096e4e4e35ee627f4a90e508e",
  "hostId": "sha256:41e6c51ed3c7ea21bb42b246d851dc9836dbd3eda091f3e25ac8281f3ec9f9a9",
  "publicKey": "MCowBQYDK2VwAyEASsJJMDe0A8ANUaeEVxAtHXXLcY2M0EG290dKMHuLx6g=",
  "keyId": "sha256:a360bb5697e62d27dfb7f5cc3afde586464915c45fb375ea0cc71e89a7d7bd8c",
  "package": {
    "schema": "ai-peer-review.process-source-package/v1",
    "sourceCommit": "d50e64f9f778f70d4346d00d2e63d645c9e0edc3",
    "tarballDigest": "sha256:baa5416c400972c8715dd0059d59ba8141b399eef1642023df5785c1737d956f",
    "inventoryDigest": "sha256:67d8977124f34864f4a2bf2d7e8b02d9e7f965d723c5da357d1adbf263d780d4",
    "contractDigest": "sha256:524b96e3e80bc4f448713ffaa1ea2a2f3f0ae8ec50722cb9072926b981690ae8"
  },
  "scope": {
    "platform": "linux",
    "build": "6.17.0-1022-azure",
    "architecture": "x64",
    "nodeMajor": 24,
    "probe": {
      "path": "/proc",
      "visibility": "full-pid-namespace",
      "errorContract": "exact-pid-directory-v1",
      "version": "procfs-v1"
    }
  },
  "kinds": ["creation"],
  "transitions": ["clock-forward", "clock-backward", "timezone", "dst"]
}
