{
  "schema": "ai-peer-review.process-source-registration/v1",
  "captureId": "source-73ca3672b9ba77889a275e505f3fce0e",
  "hostId": "sha256:3b3d354a6d5cb033823cec4cd674f9953ab76a425c4cee06f6b1daca58fb0e07",
  "publicKey": "MCowBQYDK2VwAyEAsRpqbxXhCAU7hbB9dfUEQXvjM7AGqwq3pBn5B75NIQM=",
  "keyId": "sha256:93fdafd4a83ecef64189ed357126b887e7dd81b4ee1ca18d74d33215f4dc1e52",
  "package": {
    "schema": "ai-peer-review.process-source-package/v1",
    "sourceCommit": "d754d02bbc30c6c92113e87be08c105fda08e12c",
    "tarballDigest": "sha256:0351b9272d3c012f4edf6ceee5df146aa83e0fd77bcd18214dfb673bc789c278",
    "inventoryDigest": "sha256:93da7ecb88e2df8da7ccb8c435dfbfec2831e44fe556618e99dcefc91168d9de",
    "contractDigest": "sha256:55825683bfb67863a4ab7074c4c88f7589779cb89621f0594e9740925fa1a468"
  },
  "scope": {
    "platform": "linux",
    "build": "6.17.0-1022-azure",
    "architecture": "x64",
    "nodeMajor": 26,
    "probe": {
      "path": "/proc",
      "visibility": "full-pid-namespace",
      "errorContract": "exact-pid-directory-v1",
      "version": "procfs-v1"
    }
  },
  "kinds": ["absence"],
  "transitions": []
}
