{
  "schema": "ai-peer-review.process-source-registration/v1",
  "captureId": "source-5e53dff7f0c1b4e1510042785d93767b",
  "hostId": "sha256:c8685c3c19016340473fd56d2d3e043c4d39bf5a53615fb5c46fd652b09baa32",
  "publicKey": "MCowBQYDK2VwAyEAHvtYEFCWdEnxL/ZHDvWKeEIn2RrJKjZekiOxhByKmKM=",
  "keyId": "sha256:75b23d43d893855fd2aaac1727703574a61d75ce2864834faaddd02e9c61dab6",
  "package": {
    "schema": "ai-peer-review.process-source-package/v1",
    "sourceCommit": "7d4223faf123716406c78b4fa9d0ffa553f4c73c",
    "tarballDigest": "sha256:030619632670e8f9c9368ea03f1db8f9dac910dce0faffb90f03f86cd40702c3",
    "inventoryDigest": "sha256:262ecbb6f04b37c8aca2cf6c4b42e251e201bbfb370df39e535a2a0f1043f050",
    "contractDigest": "sha256:424f35d0c9e24283d43ddc3550ed4923fdc444219331cd5fe39aa676c043fedb"
  },
  "scope": {
    "platform": "win32",
    "build": "10.0.26100",
    "architecture": "x64",
    "nodeMajor": 24,
    "probe": {
      "path": "C:\\Windows\\System32\\WindowsPowerShell\\v1.0\\powershell.exe",
      "visibility": "local-cim-query",
      "errorContract": "completed-cim-query-v1",
      "version": "sha256:54b68d3922699817166ae7ddc4a18f7864fbe61c65f3c12b94ece0b3614b4366"
    }
  },
  "kinds": ["absence"],
  "transitions": []
}
