{
  "schema": "ai-peer-review.process-source-registration/v1",
  "captureId": "source-184fd40e6bc8db76fae3519729641a78",
  "hostId": "sha256:2ccc29ffdd2dc4c7fa159bd3aa404f5dda8ce30721a7efe4551fdc3c33fef82f",
  "publicKey": "MCowBQYDK2VwAyEA4TbrTDYq7OwC9O48JkGst7ldq25ZAi3lkEodGZKBIwY=",
  "keyId": "sha256:74216718bc8b69a305dd27898d7f20a76b678f5062f3e820b47044ffb130a6c2",
  "package": {
    "schema": "ai-peer-review.process-source-package/v1",
    "sourceCommit": "9fe68172d19ce9f217fed42cf466ba5667368464",
    "tarballDigest": "sha256:785b254e1deafe56c9db4eeb60813ebe541d9272deb09907fa10707160d2fc62",
    "inventoryDigest": "sha256:dae2c97624b6a455b88923b2321d15c6d3232ff80201bbf35503e6f5996a51a5",
    "contractDigest": "sha256:340ece55ae98dcd5a8fb9cdd85b16138b0d0db3bcf44e55c13dc25b357dedb25"
  },
  "scope": {
    "platform": "win32",
    "build": "10.0.26100",
    "architecture": "x64",
    "nodeMajor": 26,
    "probe": {
      "path": "C:\\Windows\\System32\\WindowsPowerShell\\v1.0\\powershell.exe",
      "visibility": "local-cim-query",
      "errorContract": "completed-cim-query-v1",
      "version": "sha256:54b68d3922699817166ae7ddc4a18f7864fbe61c65f3c12b94ece0b3614b4366"
    }
  },
  "kinds": ["absence"],
  "transitions": []
}
