{
  "schema": "ai-peer-review.process-source-registration/v1",
  "captureId": "source-837da5f71c145f62cec19da23e75342d",
  "hostId": "sha256:d36860e708f9250e5406491cad67ccad38992e9f84271367bea415e8a6b89a3e",
  "publicKey": "MCowBQYDK2VwAyEAd3jBniH8KJ26BJ9CIydbFKX5jPYOpZO4l+6ARWQYCR8=",
  "keyId": "sha256:00b1b7d84c941b1e80966abbb85b1c9b7dc650cc04b455c7ea05f4cee7da3eb4",
  "package": {
    "schema": "ai-peer-review.process-source-package/v1",
    "sourceCommit": "edc0585afd21be8e645b4903323b116225987711",
    "tarballDigest": "sha256:8d42ec62541ba454b0ddf07e93b6c227743f2b77dc2849fa78c1bb4e74e9ebe3",
    "inventoryDigest": "sha256:671b62eb6fcf2c0393d46d1808e3a57a01085c8512ec0a0460e04e3f227e5ac6",
    "contractDigest": "sha256:e9793b094e58189caa9db25db3da6da6139ba3bddb7466fadf66df173732c66e"
  },
  "scope": {
    "platform": "darwin",
    "build": "25.6.0",
    "architecture": "arm64",
    "nodeMajor": 24,
    "probe": {
      "path": "/bin/ps",
      "visibility": "same-user-full-selection",
      "errorContract": "exact-ps-selection-v1",
      "version": "sha256:62c342e1351240eb62402b3fc8f7affed8d2d0bc8fa498df358dec09108b940f"
    }
  },
  "kinds": ["absence"],
  "transitions": []
}
