{
  "schema": "ai-peer-review.process-source-registration/v1",
  "captureId": "source-8ce2d0697b5352ca9079d59b5487fb21",
  "hostId": "sha256:cc241e29bb89f424938ed59aacb7e4704c01e46bc61afe66e9fdd15e4c4438c4",
  "publicKey": "MCowBQYDK2VwAyEAMd6N29WJfjq3BFTTzsAPkPEH9tJQY/QygfQRI/OLseg=",
  "keyId": "sha256:0c35f05caf2411126da32fb8e54dcd7e1ebf1ee2d0743a07b790364b6f572976",
  "package": {
    "schema": "ai-peer-review.process-source-package/v1",
    "sourceCommit": "11c83fa0c1b01448719bbbb336d41296fd17ec91",
    "tarballDigest": "sha256:7a5417fbd5a0ed142e2550d349f34e370a8b982caf50279bd1aaef95d1c5908a",
    "inventoryDigest": "sha256:e3c4c6c16b3b74e0a955a913f840f10dbb228be515d1bde2b4ee7a5cd2fb62c3",
    "contractDigest": "sha256:505bc7fed2cd1b35874ab5bcb30a891f5d96a699fc08fedd932060b3d4601b0e"
  },
  "scope": {
    "platform": "linux",
    "build": "6.17.0-1022-azure",
    "architecture": "x64",
    "nodeMajor": 26,
    "probe": {
      "path": "/proc",
      "visibility": "full-pid-namespace",
      "errorContract": "exact-pid-directory-v1",
      "version": "procfs-v1"
    }
  },
  "kinds": ["absence"],
  "transitions": []
}
