{
  "schema": "ai-peer-review.process-source-registration/v1",
  "captureId": "source-3313b4b8621a4c2c324e175898ee8159",
  "hostId": "sha256:670cde0079d84ccc55325a216bc385fe4ed99517a6741a0206bdbf1e7dac6d1f",
  "publicKey": "MCowBQYDK2VwAyEA9a0UJqH/pI29tw+xquRLuXuByaEs0J0txkGGynI/x6k=",
  "keyId": "sha256:35f42b14429ac127268e3b11ee528fc9908fc76c8a6d97dd0e337d7c1543dd1c",
  "package": {
    "schema": "ai-peer-review.process-source-package/v1",
    "sourceCommit": "d754d02bbc30c6c92113e87be08c105fda08e12c",
    "tarballDigest": "sha256:0351b9272d3c012f4edf6ceee5df146aa83e0fd77bcd18214dfb673bc789c278",
    "inventoryDigest": "sha256:93da7ecb88e2df8da7ccb8c435dfbfec2831e44fe556618e99dcefc91168d9de",
    "contractDigest": "sha256:55825683bfb67863a4ab7074c4c88f7589779cb89621f0594e9740925fa1a468"
  },
  "scope": {
    "platform": "linux",
    "build": "6.17.0-1022-azure",
    "architecture": "x64",
    "nodeMajor": 24,
    "probe": {
      "path": "/proc",
      "visibility": "full-pid-namespace",
      "errorContract": "exact-pid-directory-v1",
      "version": "procfs-v1"
    }
  },
  "kinds": ["creation"],
  "transitions": ["clock-forward", "clock-backward", "timezone", "dst"]
}
